{
  "slug": "demo",
  "name": "Taberna Vela y Sal",
  "register": "nocturnal",
  "lang": "es",
  "wifiSsid": "VelaYSal_Invitados",
  "placeId": "[PLACEHOLDER - replace]",
  "contact": {
    "phone": "+34 600 000 000",
    "address": "Calle del Ejemplo 12, 28013 Madrid",
    "website": "https://example.com/"
  },
  "entries": [
    { "id": "menu", "label": "Carta", "type": "link", "url": "https://example.com/carta" },
    {
      "id": "reserve",
      "label": "Reservar mesa",
      "type": "link",
      "url": "https://example.com/reservas"
    },
    {
      "id": "maps",
      "label": "Cómo llegar",
      "type": "link",
      "url": "[PLACEHOLDER - replace]"
    },
    { "id": "instagram", "label": "Instagram", "type": "link", "url": "https://www.instagram.com/" },
    { "id": "review", "label": "Reseña Google", "type": "review" },
    { "id": "wifi", "label": "WiFi", "type": "wifi" }
  ]
}
