{
  "slug": "tapas",
  "name": "[PLACEHOLDER - replace]",
  "register": "daytime",
  "lang": "es",
  "wifiSsid": "[PLACEHOLDER - replace]",
  "placeId": "[PLACEHOLDER - replace]",
  "contact": {
    "phone": "[PLACEHOLDER - replace]",
    "address": "[PLACEHOLDER - replace]",
    "website": "[PLACEHOLDER - replace]"
  },
  "entries": [
    { "id": "menu", "label": "Carta", "type": "link", "url": "[PLACEHOLDER - replace]" },
    { "id": "reserve", "label": "Reservar mesa", "type": "link", "url": "[PLACEHOLDER - replace]" },
    {
      "id": "takeaway",
      "label": "Para llevar / catering",
      "type": "link",
      "url": "[PLACEHOLDER - replace]"
    },
    { "id": "review", "label": "Reseña Google", "type": "review" },
    {
      "id": "newsletter",
      "label": "Newsletter / club de socios",
      "type": "link",
      "url": "[PLACEHOLDER - replace]"
    },
    { "id": "instagram", "label": "Instagram", "type": "link", "url": "[PLACEHOLDER - replace]" },
    { "id": "wifi", "label": "WiFi", "type": "wifi" },
    { "id": "vcard", "label": "Guardar contacto", "type": "vcard" }
  ]
}
